[
  {
    "attributeId": "product_category",
    "label": "Product Category",
    "type": "select",
    "isRequired": true,
    "defaultValue": null,
    "sortOrder": 1,
    "options": [
      {
        "value": "structural_materials",
        "label": "Structural Materials"
      },
      {
        "value": "framing_insulation",
        "label": "Framing & Insulation"
      },
      {
        "value": "windows_doors",
        "label": "Windows & Doors"
      },
      {
        "value": "fasteners_hardware",
        "label": "Fasteners & Hardware"
      },
      {
        "value": "safety_equipment",
        "label": "Safety Equipment"
      }
    ]
  },
  {
    "attributeId": "brand",
    "label": "Brand",
    "type": "select",
    "isRequired": false,
    "defaultValue": null,
    "sortOrder": 2,
    "options": [
      {
        "value": "buildright_pro",
        "label": "BuildRight Pro"
      },
      {
        "value": "structuremaster",
        "label": "StructureMaster"
      },
      {
        "value": "proframe",
        "label": "ProFrame"
      },
      {
        "value": "safeguard",
        "label": "SafeGuard"
      },
      {
        "value": "fastenpro",
        "label": "FastenPro"
      },
      {
        "value": "durabuilt",
        "label": "DuraBuilt"
      },
      {
        "value": "toughgrip",
        "label": "ToughGrip"
      },
      {
        "value": "maxstrength",
        "label": "MaxStrength"
      },
      {
        "value": "premiumbuild",
        "label": "PremiumBuild"
      },
      {
        "value": "reliabuild",
        "label": "ReliaBuild"
      }
    ]
  },
  {
    "attributeId": "unit_of_measure",
    "label": "Unit of Measure",
    "type": "select",
    "isRequired": true,
    "defaultValue": "EA",
    "sortOrder": 3,
    "options": [
      {
        "value": "EA",
        "label": "Each"
      },
      {
        "value": "LF",
        "label": "Linear Foot"
      },
      {
        "value": "SF",
        "label": "Square Foot"
      },
      {
        "value": "BOX",
        "label": "Box"
      },
      {
        "value": "BUNDLE",
        "label": "Bundle"
      },
      {
        "value": "PALLET",
        "label": "Pallet"
      },
      {
        "value": "BAG",
        "label": "Bag"
      },
      {
        "value": "ROLL",
        "label": "Roll"
      },
      {
        "value": "PAIR",
        "label": "Pair"
      },
      {
        "value": "SHEET",
        "label": "Sheet"
      },
      {
        "value": "GALLON",
        "label": "Gallon"
      },
      {
        "value": "CASE",
        "label": "Case"
      }
    ]
  },
  {
    "attributeId": "project_types",
    "label": "Project Types",
    "type": "multiselect",
    "isRequired": false,
    "defaultValue": null,
    "sortOrder": 4,
    "options": [
      {
        "value": "new_construction",
        "label": "New Construction"
      },
      {
        "value": "remodel",
        "label": "Remodel/Renovation"
      },
      {
        "value": "repair",
        "label": "Repair/Maintenance"
      },
      {
        "value": "restoration",
        "label": "Restoration"
      }
    ]
  },
  {
    "attributeId": "lumber_species",
    "label": "Lumber Species",
    "type": "select",
    "isRequired": false,
    "defaultValue": null,
    "sortOrder": 10,
    "options": [
      {
        "value": "southern_yellow_pine",
        "label": "Southern Yellow Pine (SYP)"
      },
      {
        "value": "spruce_pine_fir",
        "label": "Spruce-Pine-Fir (SPF)"
      },
      {
        "value": "douglas_fir_larch",
        "label": "Douglas Fir-Larch (DF-L)"
      },
      {
        "value": "hem_fir",
        "label": "Hem-Fir"
      },
      {
        "value": "western_red_cedar",
        "label": "Western Red Cedar"
      },
      {
        "value": "redwood",
        "label": "Redwood"
      }
    ]
  },
  {
    "attributeId": "lumber_grade",
    "label": "Lumber Grade",
    "type": "select",
    "isRequired": false,
    "defaultValue": null,
    "sortOrder": 11,
    "options": [
      {
        "value": "select_structural",
        "label": "Select Structural"
      },
      {
        "value": "no_1",
        "label": "No. 1"
      },
      {
        "value": "no_2",
        "label": "No. 2"
      },
      {
        "value": "no_3",
        "label": "No. 3"
      },
      {
        "value": "stud",
        "label": "Stud"
      },
      {
        "value": "utility",
        "label": "Utility"
      },
      {
        "value": "construction",
        "label": "Construction"
      },
      {
        "value": "standard",
        "label": "Standard"
      }
    ]
  },
  {
    "attributeId": "lumber_treatment",
    "label": "Lumber Treatment",
    "type": "select",
    "isRequired": false,
    "defaultValue": null,
    "sortOrder": 12,
    "options": [
      {
        "value": "kiln_dried",
        "label": "Kiln-Dried (KD)"
      },
      {
        "value": "green",
        "label": "Green (Unseasoned)"
      },
      {
        "value": "pressure_treated_aca",
        "label": "Pressure-Treated (ACA)"
      },
      {
        "value": "pressure_treated_acq",
        "label": "Pressure-Treated (ACQ)"
      },
      {
        "value": "pressure_treated_ca",
        "label": "Pressure-Treated (CA-C)"
      },
      {
        "value": "fire_retardant",
        "label": "Fire-Retardant Treated"
      }
    ]
  },
  {
    "attributeId": "lumber_certification",
    "label": "Lumber Certification",
    "type": "multiselect",
    "isRequired": false,
    "defaultValue": null,
    "sortOrder": 13,
    "options": [
      {
        "value": "fsc_certified",
        "label": "FSC Certified"
      },
      {
        "value": "fsc_mix",
        "label": "FSC Mix"
      },
      {
        "value": "sfi_certified",
        "label": "SFI Certified"
      },
      {
        "value": "pefc_certified",
        "label": "PEFC Certified"
      },
      {
        "value": "none",
        "label": "No Certification"
      }
    ]
  },
  {
    "attributeId": "drywall_thickness",
    "label": "Drywall Thickness",
    "type": "select",
    "isRequired": false,
    "defaultValue": null,
    "sortOrder": 20,
    "options": [
      {
        "value": "0.25",
        "label": "1/4\""
      },
      {
        "value": "0.375",
        "label": "3/8\""
      },
      {
        "value": "0.5",
        "label": "1/2\""
      },
      {
        "value": "0.625",
        "label": "5/8\""
      },
      {
        "value": "0.75",
        "label": "3/4\""
      }
    ]
  },
  {
    "attributeId": "drywall_product_type",
    "label": "Drywall Product Type",
    "type": "select",
    "isRequired": false,
    "defaultValue": null,
    "sortOrder": 21,
    "options": [
      {
        "value": "regular",
        "label": "Regular Gypsum"
      },
      {
        "value": "moisture_resistant",
        "label": "Moisture-Resistant (MR)"
      },
      {
        "value": "mold_resistant",
        "label": "Mold-Resistant"
      },
      {
        "value": "fire_rated",
        "label": "Fire-Rated"
      },
      {
        "value": "sound_dampening",
        "label": "Sound-Dampening"
      },
      {
        "value": "impact_resistant",
        "label": "Impact/Abuse-Resistant"
      }
    ]
  },
  {
    "attributeId": "drywall_fire_rating",
    "label": "Drywall Fire Rating",
    "type": "select",
    "isRequired": false,
    "defaultValue": null,
    "sortOrder": 22,
    "options": [
      {
        "value": "non_rated",
        "label": "Non-Rated"
      },
      {
        "value": "type_x",
        "label": "Type X (1-hour)"
      },
      {
        "value": "type_c",
        "label": "Type C (Enhanced)"
      }
    ]
  },
  {
    "attributeId": "drywall_edge_type",
    "label": "Drywall Edge Type",
    "type": "select",
    "isRequired": false,
    "defaultValue": null,
    "sortOrder": 23,
    "options": [
      {
        "value": "tapered",
        "label": "Tapered"
      },
      {
        "value": "square",
        "label": "Square"
      },
      {
        "value": "beveled",
        "label": "Beveled"
      },
      {
        "value": "tongue_and_groove",
        "label": "Tongue & Groove"
      }
    ]
  },
  {
    "attributeId": "window_material",
    "label": "Window Frame Material",
    "type": "select",
    "isRequired": false,
    "defaultValue": null,
    "sortOrder": 30,
    "options": [
      {
        "value": "vinyl",
        "label": "Vinyl"
      },
      {
        "value": "wood",
        "label": "Wood"
      },
      {
        "value": "aluminum",
        "label": "Aluminum"
      },
      {
        "value": "fiberglass",
        "label": "Fiberglass"
      },
      {
        "value": "composite",
        "label": "Composite"
      },
      {
        "value": "clad_wood",
        "label": "Clad Wood"
      }
    ]
  },
  {
    "attributeId": "window_operation_type",
    "label": "Window Operation Type",
    "type": "select",
    "isRequired": false,
    "defaultValue": null,
    "sortOrder": 31,
    "options": [
      {
        "value": "single_hung",
        "label": "Single-Hung"
      },
      {
        "value": "double_hung",
        "label": "Double-Hung"
      },
      {
        "value": "casement",
        "label": "Casement"
      },
      {
        "value": "awning",
        "label": "Awning"
      },
      {
        "value": "sliding",
        "label": "Sliding"
      },
      {
        "value": "fixed",
        "label": "Fixed/Picture"
      },
      {
        "value": "bay",
        "label": "Bay"
      },
      {
        "value": "bow",
        "label": "Bow"
      }
    ]
  },
  {
    "attributeId": "window_glazing_type",
    "label": "Window Glazing",
    "type": "select",
    "isRequired": false,
    "defaultValue": null,
    "sortOrder": 32,
    "options": [
      {
        "value": "single_pane",
        "label": "Single Pane"
      },
      {
        "value": "double_pane",